Microsoft Windows [Version 10.0.17134.648]
(c) 2018 Microsoft Corporation. All rights reserved.

C:\Users\Asus>D:

D:\>CD XAMPP\MySql\bin

D:\xampp\mysql\bin>MySql.exe -u root
Welcome to the MariaDB monitor.  Commands end with ; or \g.
Your MariaDB connection id is 9
Server version: 10.1.34-MariaDB mariadb.org binary distribution

Copyright (c) 2000, 2018, Oracle, MariaDB Corporation Ab and others.

Type 'help;' or '\h' for help. Type '\c' to clear the current input statement.

MariaDB [(none)]> show databases;
+--------------------+
| Database           |
+--------------------+
| data_mahasiswa     |
| employee           |
| information_schema |
| latihan01          |
| mysql              |
| performance_schema |
| pet_home           |
| phpmyadmin         |
| test               |
+--------------------+
9 rows in set (0.00 sec)

MariaDB [(none)]> use data_mahasiswa;
Database changed
MariaDB [data_mahasiswa]> show tables;
+--------------------------+
| Tables_in_data_mahasiswa |
+--------------------------+
| biodata_singkat          |
+--------------------------+
1 row in set (0.00 sec)

MariaDB [data_mahasiswa]> select * from biodata_singkat;
+----------+---------------+--------------+----------+----------+---------------+-------+------------+------------+
| nim      | nama          | alamat_jalan | kota     | kode_pos | jenis_kelamin | no_hp | tgl_lhr    | kode_dosen |
+----------+---------------+--------------+----------+----------+---------------+-------+------------+------------+
| 11223344 | Ari Santoso   |              | Bekasi   |          | Laki-laki     |       | 1979-08-31 |            |
| 11223345 | Ario Talib    |              | Cikarang |          | Laki-laki     |       | 1999-11-16 |            |
| 11223346 | Dina Marlina  |              | Karawang |          | Perempuan     |       | 1997-12-01 |            |
| 11223347 | Lisa Ayu      |              | Bekasi   |          | Perempuan     |       | 1986-01-02 |            |
| 11223348 | Tiara Wahidah |              | Bekasi   |          | Perempuan     |       | 1980-02-05 |            |
| 11223349 | Anton Sinaga  |              | Cikarang |          | Laki-laki     |       | 1988-03-10 |            |
+----------+---------------+--------------+----------+----------+---------------+-------+------------+------------+
6 rows in set (0.00 sec)

MariaDB [data_mahasiswa]> update biodata_singkat set tgl_lhr ='1998-10-12' where nim ='11223344';
Query OK, 1 row affected (0.08 sec)
Rows matched: 1  Changed: 1  Warnings: 0

MariaDB [data_mahasiswa]> select * from biodata_singkat;
+----------+---------------+--------------+----------+----------+---------------+-------+------------+------------+
| nim      | nama          | alamat_jalan | kota     | kode_pos | jenis_kelamin | no_hp | tgl_lhr    | kode_dosen |
+----------+---------------+--------------+----------+----------+---------------+-------+------------+------------+
| 11223344 | Ari Santoso   |              | Bekasi   |          | Laki-laki     |       | 1998-10-12 |            |
| 11223345 | Ario Talib    |              | Cikarang |          | Laki-laki     |       | 1999-11-16 |            |
| 11223346 | Dina Marlina  |              | Karawang |          | Perempuan     |       | 1997-12-01 |            |
| 11223347 | Lisa Ayu      |              | Bekasi   |          | Perempuan     |       | 1986-01-02 |            |
| 11223348 | Tiara Wahidah |              | Bekasi   |          | Perempuan     |       | 1980-02-05 |            |
| 11223349 | Anton Sinaga  |              | Cikarang |          | Laki-laki     |       | 1988-03-10 |            |
+----------+---------------+--------------+----------+----------+---------------+-------+------------+------------+
6 rows in set (0.00 sec)

MariaDB [data_mahasiswa]> select * from biodata_singkat where nim = '11223344';
+----------+-------------+--------------+--------+----------+---------------+-------+------------+------------+
| nim      | nama        | alamat_jalan | kota   | kode_pos | jenis_kelamin | no_hp | tgl_lhr    | kode_dosen |
+----------+-------------+--------------+--------+----------+---------------+-------+------------+------------+
| 11223344 | Ari Santoso |              | Bekasi |          | Laki-laki     |       | 1998-10-12 |            |
+----------+-------------+--------------+--------+----------+---------------+-------+------------+------------+
1 row in set (0.00 sec)

MariaDB [data_mahasiswa]> delete from biodata_singkat where nim = '11223346';
Query OK, 1 row affected (0.12 sec)

MariaDB [data_mahasiswa]> select * from biodata_singkat;
+----------+---------------+--------------+----------+----------+---------------+-------+------------+------------+
| nim      | nama          | alamat_jalan | kota     | kode_pos | jenis_kelamin | no_hp | tgl_lhr    | kode_dosen |
+----------+---------------+--------------+----------+----------+---------------+-------+------------+------------+
| 11223344 | Ari Santoso   |              | Bekasi   |          | Laki-laki     |       | 1998-10-12 |            |
| 11223345 | Ario Talib    |              | Cikarang |          | Laki-laki     |       | 1999-11-16 |            |
| 11223347 | Lisa Ayu      |              | Bekasi   |          | Perempuan     |       | 1986-01-02 |            |
| 11223348 | Tiara Wahidah |              | Bekasi   |          | Perempuan     |       | 1980-02-05 |            |
| 11223349 | Anton Sinaga  |              | Cikarang |          | Laki-laki     |       | 1988-03-10 |            |
+----------+---------------+--------------+----------+----------+---------------+-------+------------+------------+
5 rows in set (0.00 sec)

MariaDB [data_mahasiswa]> select * from biodata_singkat where tgl_lhr >= '1996-01-02';
+----------+-------------+--------------+----------+----------+---------------+-------+------------+------------+
| nim      | nama        | alamat_jalan | kota     | kode_pos | jenis_kelamin | no_hp | tgl_lhr    | kode_dosen |
+----------+-------------+--------------+----------+----------+---------------+-------+------------+------------+
| 11223344 | Ari Santoso |              | Bekasi   |          | Laki-laki     |       | 1998-10-12 |            |
| 11223345 | Ario Talib  |              | Cikarang |          | Laki-laki     |       | 1999-11-16 |            |
+----------+-------------+--------------+----------+----------+---------------+-------+------------+------------+
2 rows in set (0.03 sec)

MariaDB [data_mahasiswa]> select * from biodata_singkat where kota = 'bekasi' and jenis_kelamin = 'Perempuan';
+----------+---------------+--------------+--------+----------+---------------+-------+------------+------------+
| nim      | nama          | alamat_jalan | kota   | kode_pos | jenis_kelamin | no_hp | tgl_lhr    | kode_dosen |
+----------+---------------+--------------+--------+----------+---------------+-------+------------+------------+
| 11223347 | Lisa Ayu      |              | Bekasi |          | Perempuan     |       | 1986-01-02 |            |
| 11223348 | Tiara Wahidah |              | Bekasi |          | Perempuan     |       | 1980-02-05 |            |
+----------+---------------+--------------+--------+----------+---------------+-------+------------+------------+
2 rows in set (0.00 sec)

MariaDB [data_mahasiswa]> select nama, kota, jenis_kelamin, tgl_lhr from biodata_singkat where kota = 'Bekasi' and jenis_kelamin = 'Laki-laki' or tgl_lhr > 22 and jenis_kelamin = 'Perempuan' order by nama;
+---------------+--------+---------------+------------+
| nama          | kota   | jenis_kelamin | tgl_lhr    |
+---------------+--------+---------------+------------+
| Ari Santoso   | Bekasi | Laki-laki     | 1998-10-12 |
| Lisa Ayu      | Bekasi | Perempuan     | 1986-01-02 |
| Tiara Wahidah | Bekasi | Perempuan     | 1980-02-05 |
+---------------+--------+---------------+------------+
3 rows in set, 1 warning (0.00 sec)

MariaDB [data_mahasiswa]> select nama, alamat_jalan from biodata_singkat ;
+---------------+--------------+
| nama          | alamat_jalan |
+---------------+--------------+
| Ari Santoso   |              |
| Ario Talib    |              |
| Lisa Ayu      |              |
| Tiara Wahidah |              |
| Anton Sinaga  |              |
+---------------+--------------+
5 rows in set (0.00 sec)

MariaDB [data_mahasiswa]> select * from biodata_singkat order by nama ASC;
+----------+---------------+--------------+----------+----------+---------------+-------+------------+------------+
| nim      | nama          | alamat_jalan | kota     | kode_pos | jenis_kelamin | no_hp | tgl_lhr    | kode_dosen |
+----------+---------------+--------------+----------+----------+---------------+-------+------------+------------+
| 11223349 | Anton Sinaga  |              | Cikarang |          | Laki-laki     |       | 1988-03-10 |            |
| 11223344 | Ari Santoso   |              | Bekasi   |          | Laki-laki     |       | 1998-10-12 |            |
| 11223345 | Ario Talib    |              | Cikarang |          | Laki-laki     |       | 1999-11-16 |            |
| 11223347 | Lisa Ayu      |              | Bekasi   |          | Perempuan     |       | 1986-01-02 |            |
| 11223348 | Tiara Wahidah |              | Bekasi   |          | Perempuan     |       | 1980-02-05 |            |
+----------+---------------+--------------+----------+----------+---------------+-------+------------+------------+
5 rows in set (0.00 sec)

MariaDB [data_mahasiswa]> select * from biodata_singkat order by nama DESC;
+----------+---------------+--------------+----------+----------+---------------+-------+------------+------------+
| nim      | nama          | alamat_jalan | kota     | kode_pos | jenis_kelamin | no_hp | tgl_lhr    | kode_dosen |
+----------+---------------+--------------+----------+----------+---------------+-------+------------+------------+
| 11223348 | Tiara Wahidah |              | Bekasi   |          | Perempuan     |       | 1980-02-05 |            |
| 11223347 | Lisa Ayu      |              | Bekasi   |          | Perempuan     |       | 1986-01-02 |            |
| 11223345 | Ario Talib    |              | Cikarang |          | Laki-laki     |       | 1999-11-16 |            |
| 11223344 | Ari Santoso   |              | Bekasi   |          | Laki-laki     |       | 1998-10-12 |            |
| 11223349 | Anton Sinaga  |              | Cikarang |          | Laki-laki     |       | 1988-03-10 |            |
+----------+---------------+--------------+----------+----------+---------------+-------+------------+------------+
5 rows in set (0.00 sec)

MariaDB [data_mahasiswa]>